{
  "$schema": "https://nsis-dev.github.io/data/versions.schema.json",
  "generatedAt": "2026-04-30T21:10:21.173Z",
  "source": "sourceforge.net/projects/nsis",
  "versions": {
    "2.08": {
      "version": "2.08",
      "major": 2,
      "channel": "stable",
      "preRelease": null,
      "releasedAt": "2005-07-23",
      "artifacts": {
        "zip": {
          "url": "https://downloads.sourceforge.net/project/nsis/NSIS%202/2.08/nsis-2.08.zip",
          "filename": "nsis-2.08.zip",
          "size": 1859677,
          "hashes": {
            "sha1": "e7e3c8d60197af220695c5c9bf242881e32790bb",
            "sha256": "0b672007ca0c26bf8735af94d918a144778f3ff972ddcf1b4005cc53f57c6566",
            "sha512": "762ce13672036168b5fa4f6ef3e94b65ea6a7f2b7d27c96cffed408ea2e049f8e43dc910c40453fefc1c4e961fa92f2d177a66743a6d3c40d2bb33fb2edd07e5"
          }
        },
        "sourceTarball": {
          "url": "https://downloads.sourceforge.net/project/nsis/NSIS%202/2.08/nsis-2.08-src.tar.bz2",
          "filename": "nsis-2.08-src.tar.bz2",
          "size": 1599034,
          "hashes": {
            "sha1": "d54319747aea578dcd2120b5a4167d7d364bec18",
            "sha256": "7a9ce925df5a3b2bbcb85042e884d1e5268b10f39aa3e004ee87a1b03304dafe",
            "sha512": "b5c91e5056f07a606ae0b9c358e9b145c0b91d16da37d873b717ce55be0890793af05cb8bc3b1a2b36ea42384baa489bbc1b6108cc368428c7e11784b96eeed8"
          }
        }
      }
    },
    "2.09": {
      "version": "2.09",
      "major": 2,
      "channel": "stable",
      "preRelease": null,
      "releasedAt": "2005-08-26",
      "artifacts": {
        "zip": {
          "url": "https://downloads.sourceforge.net/project/nsis/NSIS%202/2.09/nsis-2.09.zip",
          "filename": "nsis-2.09.zip",
          "size": 1864808,
          "hashes": {
            "sha1": "9aca030a652efa2993575370ebc66766c04de95c",
            "sha256": "2cc6c45c157e4f5cec241ffcfc41e7d1ce517780625e3766d6d7ed37eb23a7ca",
            "sha512": "dabf841f27a42f2b5a8dcca1533c81fe725636db33742e4c868b4d5a081c251065c51ba67cefd08faa11f5456fcf09d8e2123e075051344c6eadcd6d3b79812e"
          }
        },
        "sourceTarball": {
          "url": "https://downloads.sourceforge.net/project/nsis/NSIS%202/2.09/nsis-2.09-src.tar.bz2",
          "filename": "nsis-2.09-src.tar.bz2",
          "size": 1600016,
          "hashes": {
            "sha1": "c6227e69c9f0a755c3545e4361bbda9b7345f869",
            "sha256": "49a81c5ace05019a56ff9b75b27be08c806dd2c427c572a00b12742f7e03e252",
            "sha512": "3bf0472947dd0675db91cdba81afebd5ccf2edd3b279156b456ce37725b10e79310739cca153ea9fa8fffb1c557b3db4fb397c6b7c66bc93a3cdd5c3c4404269"
          }
        }
      }
    },
    "2.10": {
      "version": "2.10",
      "major": 2,
      "channel": "stable",
      "preRelease": null,
      "releasedAt": "2005-10-04",
      "artifacts": {
        "zip": {
          "url": "https://downloads.sourceforge.net/project/nsis/NSIS%202/2.10/nsis-2.10.zip",
          "filename": "nsis-2.10.zip",
          "size": 1897845,
          "hashes": {
            "sha1": "20c7f7cdafebee74e52803c7ad75ae009ea2b30c",
            "sha256": "00350d3ef1b4308e40e701fc91cbb390128954f6a4af27c772e91c28e16bcb17",
            "sha512": "4371c7cacd1efd74f3c0ef036a6112cd508ffaef2a365d3f1cfd506d9668621adec7cd4b8d4c3e226fc1f24de276660366a37ec8c5d887e9b641d906392937cf"
          }
        },
        "sourceTarball": {
          "url": "https://downloads.sourceforge.net/project/nsis/NSIS%202/2.10/nsis-2.10-src.tar.bz2",
          "filename": "nsis-2.10-src.tar.bz2",
          "size": 1549928,
          "hashes": {
            "sha1": "1a3c7f55fda402e382beaa52b36ae1e9bd20de1d",
            "sha256": "f7fe442659f3460c4c6dd8414637258f10f0ddd3daa831f34bbcbcf256728904",
            "sha512": "8717a3e38e718facc264bf654ef1f468199f5431510d9cb0c41ea374c53f9aed368011ab148ec8867a58053d58e540df7f8286a42dbb2ae3fcf689fe13b95aed"
          }
        }
      }
    },
    "2.11": {
      "version": "2.11",
      "major": 2,
      "channel": "stable",
      "preRelease": null,
      "releasedAt": "2005-11-12",
      "artifacts": {
        "zip": {
          "url": "https://downloads.sourceforge.net/project/nsis/NSIS%202/2.11/nsis-2.11.zip",
          "filename": "nsis-2.11.zip",
          "size": 1944445,
          "hashes": {
            "sha1": "67114175c443c3b2b3181a83ca6ed5614ff81e05",
            "sha256": "1e0b4e00a225ba0e6c640c94e21df845246c371d660bab2a6307d5d4d5038b55",
            "sha512": "f27acf5774c682c206ce17e5129634f7cedc155bb4f0a7602a89af8dda19a7b6cbbeda744b876a684df9d18f36206b85c13195a7c8bfb2da7a73b88bd16d099c"
          }
        },
        "sourceTarball": {
          "url": "https://downloads.sourceforge.net/project/nsis/NSIS%202/2.11/nsis-2.11-src.tar.bz2",
          "filename": "nsis-2.11-src.tar.bz2",
          "size": 1556152,
          "hashes": {
            "sha1": "0e7d840078449343291cf599c1c516838d6c691e",
            "sha256": "d45e59d1a990b1e06cded14afd48fe80e025d968c54ea70525a89d9601f2b500",
            "sha512": "1663ab90e74852d842eef2d4ecdce4ec2488a902fbfeb7d555fab00d3425838498dc34e3108db69fb44a0ef224e2fc22b7f11aeee867f152818dbe9f4220aebb"
          }
        }
      }
    },
    "2.12": {
      "version": "2.12",
      "major": 2,
      "channel": "stable",
      "preRelease": null,
      "releasedAt": "2005-12-17",
      "artifacts": {
        "zip": {
          "url": "https://downloads.sourceforge.net/project/nsis/NSIS%202/2.12/nsis-2.12.zip",
          "filename": "nsis-2.12.zip",
          "size": 1953720,
          "hashes": {
            "sha1": "88de1b3ea6559209f9bf6f76e0e5708978c0ae0e",
            "sha256": "1ea4c49b34ca550ca356938d22757920aa000773c60b5574e4db149e575d2a90",
            "sha512": "0adf8c9d59605550e3d532689626f2e7e429847d7c998a7cc599f2a615bc371ae6778a74a2cc98c0dd43e8c6bebd0be8ccf7839a80a99d22a85c32b18f2747d5"
          }
        },
        "sourceTarball": {
          "url": "https://downloads.sourceforge.net/project/nsis/NSIS%202/2.12/nsis-2.12-src.tar.bz2",
          "filename": "nsis-2.12-src.tar.bz2",
          "size": 1564803,
          "hashes": {
            "sha1": "a458bdcbda37ecf29f0ddd8c10d36c1ed4acd763",
            "sha256": "906a5fea9f548c89ab46c39ae4c0dc9dc5bdcd9a0bc7ee9c87dae51d8eb62610",
            "sha512": "3ec8e61b6d61679c5ee05c0e94f8fba3134f27c56def507ac2ba5d88cb739ad89ce26fe87d29872cbe8d27ecf955211514ce61ecf4e0c0772264375032010698"
          }
        }
      }
    },
    "2.13": {
      "version": "2.13",
      "major": 2,
      "channel": "stable",
      "preRelease": null,
      "releasedAt": "2006-01-21",
      "artifacts": {
        "zip": {
          "url": "https://downloads.sourceforge.net/project/nsis/NSIS%202/2.13/nsis-2.13.zip",
          "filename": "nsis-2.13.zip",
          "size": 1957790,
          "hashes": {
            "sha1": "237e33a544ddccf7fc522b9274f8fa3d9fb7c7bc",
            "sha256": "6ee9263711aed52259204ebc46ff7a9e4b97cbfe7ddab14b09a26d2467492bb5",
            "sha512": "e5603a6b68e7bf5cc798f7994397fddf0f0d5c9faea643be0b7a75a9a90eb6779c1ee28a384b1f4f3767ac87e51e083143e58e5836863775831c48fdc7b3e41e"
          }
        },
        "sourceTarball": {
          "url": "https://downloads.sourceforge.net/project/nsis/NSIS%202/2.13/nsis-2.13-src.tar.bz2",
          "filename": "nsis-2.13-src.tar.bz2",
          "size": 1569224,
          "hashes": {
            "sha1": "ededc533a1931d6cc129f49e6b5bc13b1b662f6d",
            "sha256": "a34d58c3a290b76448bac63bed7820f6f2aac80eaf0077eea3008e0f65ac79aa",
            "sha512": "b179bb9a24ed8cf750aa81bc33b5620447a5e6b7eadf429c871f35a0cddface93239bdc38ca1936abd030d0e2f0adad9ea5a4d3570ce2544c41dbd1afeed9640"
          }
        }
      }
    },
    "2.14": {
      "version": "2.14",
      "major": 2,
      "channel": "stable",
      "preRelease": null,
      "releasedAt": "2006-01-24",
      "artifacts": {
        "zip": {
          "url": "https://downloads.sourceforge.net/project/nsis/NSIS%202/2.14/nsis-2.14.zip",
          "filename": "nsis-2.14.zip",
          "size": 1959364,
          "hashes": {
            "sha1": "50325d80533b30e9e3788c66b3633cfae2cd3efd",
            "sha256": "88195a2a1b1bb65baa8f1efc6e2864ca021ccf95a4fc825c6a9bf354f856eb17",
            "sha512": "8e9c6665d3281a8c4a6b2a1b7e90b0f71241ce046a9406f17462c48e27f8a45586a2bbe7676beae63921d20741606e7c15108b7163685b3b33b83386ac494d93"
          }
        },
        "sourceTarball": {
          "url": "https://downloads.sourceforge.net/project/nsis/NSIS%202/2.14/nsis-2.14-src.tar.bz2",
          "filename": "nsis-2.14-src.tar.bz2",
          "size": 1569846,
          "hashes": {
            "sha1": "55f0b4c1e6354a38fc0feb14adda400eaca42d30",
            "sha256": "9aaf85dbf02d8532995550e53ba41f537f6c354357f04a6e9048b143d5f7661f",
            "sha512": "9a537405093ae22d0c980d600f73343ceba71679e647e2a588fc6060e5f5f5ae6b937c2bff7faa036d451926307f6c8659e648fa474ee925d530d847fec8499e"
          }
        }
      }
    },
    "2.15": {
      "version": "2.15",
      "major": 2,
      "channel": "stable",
      "preRelease": null,
      "releasedAt": "2006-03-04",
      "artifacts": {
        "zip": {
          "url": "https://downloads.sourceforge.net/project/nsis/NSIS%202/2.15/nsis-2.15.zip",
          "filename": "nsis-2.15.zip",
          "size": 1967602,
          "hashes": {
            "sha1": "47e79c78b0b91163c4c50aa1bc84f27149287416",
            "sha256": "aebcf7d70bf14c36924c0cb76c03b78f828f8f187577f1a7e4b72b14ee67ccf0",
            "sha512": "0ddd1e585a66240c4accfc506d0a2865f92d08f56e42c3089a6b5b4e33a8e929611b8cc0e2469b32470c8ba07ec9f9d87860b68d5821aa9d67352f7c4159d824"
          }
        },
        "sourceTarball": {
          "url": "https://downloads.sourceforge.net/project/nsis/NSIS%202/2.15/nsis-2.15-src.tar.bz2",
          "filename": "nsis-2.15-src.tar.bz2",
          "size": 1573244,
          "hashes": {